<?xml version="1.0" encoding="UTF-8"?>
<mapper xmlns="https://www.dbvisitor.net/schema"
        xmlns:xsi="http://www.w3.org/2001/XMLSchema-instance"
        xsi:schemaLocation="https://www.dbvisitor.net/schema https://www.dbvisitor.net/schema/dbvisitor-mapper.xsd"
        namespace="net.hasor.dbvisitor.mapper.dto.ApiBasicConfigTwoMapper">
    <resultMap id="userInfo" type="net.hasor.dbvisitor.mapper.dto.UserInfo" autoMapping="true"/>

    <select id="configQuery1" statementType="CALLABLE" timeout="123" fetchSize="512" resultSetType="FORWARD_ONLY"
            resultMap="userInfo"
            bindOut="out1,out2">
        select * from console_job where aac = #{abc}
    </select>

    <select id="configQuery2" statementType="CALLABLE" timeout="123" fetchSize="512" resultSetType="FORWARD_ONLY"
            resultType="net.hasor.dbvisitor.mapper.dto.UserInfoExt"
            bindOut="out1,out2">
        select * from console_job where aac = #{abc}
    </select>

    <select id="configQuery3" statementType="CALLABLE" timeout="123" fetchSize="512" resultSetType="FORWARD_ONLY"
            resultSetExtractor="net.hasor.dbvisitor.mapper.dto.UserNameResultSetExtractor"
            bindOut="out1,out2">
        select * from console_job where aac = #{abc}
    </select>

    <select id="configQuery4" statementType="CALLABLE" timeout="123" fetchSize="512" resultSetType="FORWARD_ONLY"
            resultRowCallback="net.hasor.dbvisitor.mapper.dto.UserNameRowCallback"
            bindOut="out1,out2">
        select * from console_job where aac = #{abc}
    </select>

    <select id="configQuery5" statementType="CALLABLE" timeout="123" fetchSize="512" resultSetType="FORWARD_ONLY"
            resultRowMapper="net.hasor.dbvisitor.mapper.dto.UserNameRowMapper"
            bindOut="out1,out2">
        select * from console_job where aac = #{abc}
    </select>

    <insert id="configInsert" statementType="CALLABLE" timeout="123" useGeneratedKeys="true" keyProperty="numId"
            keyColumn="num_id" generatedKeySource="resultSet">
        insert into console_job (uid,name,login) values (#{info.userUuid}, #{info.name}, #{info.loginName})
    </insert>

    <insert id="configInsertSelectKey" statementType="CALLABLE" timeout="123" useGeneratedKeys="true"
            keyProperty="numId" keyColumn="num_id">
        insert into console_job (uid,name,login) values (#{info.userUuid}, #{info.name}, #{info.loginName})
        <selectKey statementType="CALLABLE" timeout="123" fetchSize="512" resultSetType="FORWARD_ONLY"
                   keyProperty="userUuid" keyColumn="uid" order="AFTER">
            select last_insert_id()
        </selectKey>
    </insert>

    <update id="configUpdate" statementType="CALLABLE" timeout="123">
        update console_job set uid = #{uuid} where id = #{id}
    </update>

    <delete id="configDelete" statementType="CALLABLE" timeout="123">
        delete console_job where id = #{id}
    </delete>

    <execute id="configExecute" statementType="CALLABLE" timeout="123">
        create table console_job (uid int,name varchar(200),login varchar(200))
    </execute>
</mapper>